{
  "schema": "vvfp.vv3_expanded_256_save_serializer_abi_gate",
  "schema_version": 1,
  "contract_id": "x3-vv3-expanded-256-save-serializer-abi-evidence-gate",
  "status": "STOP",
  "enabled": false,
  "bindings": {
    "source_sha256": "8BC5DB382D02BC5C21AD5F607580D60FF44A6519CC7EB133F03113BAACAE6503",
    "prototype_sha256": "6EE3361A7AC35F441763647C1E2FC9EC49569DE5EF372BDB41D243D03002D601",
    "authenticated_evidence_commit": "8444df9c314f8ee9a6a29930a9d1be1e70e6adb7",
    "runtime_harness_commit": "0940bb5328217aee7a08963ce22c7dddc3ca4503",
    "stored_index_commit": "37b06b18ae72d877f893c4f8c36ce3a67506bb7e",
    "stored_index_gate_sha256": "FE66D22010BC42302136C2B4EFD8100AF2D5938802CA52156313E235BCC56D0C",
    "folder_inventory_schema_sha256": "118986E7F78F90597BF2B804D7C68DBE41158C599098A4F9A2E2C652AF3675FE",
    "runtime_receipt_schema_sha256": "52F8B12D1FFBB87A5D25381DD6D8172B118467015F17C805C10F5604E6FAAB52",
    "exporter_manifest_schema_sha256": "EE94B02D964DFCE7729BE610DC6AAD1553E88B65ADF31CD9E763CB84A15767BE",
    "runtime_harness_sha256": "AB1C8A37A2B3450501A62404E6E6C6342F545AC8F0828EACC0DC4A8589861D67"
  },
  "native_rows": [
    {"id":"loader_entry","ea":"0x428949","file_offset":"0x28949","role":"loader","expected":null,"evidence_refs":[]},
    {"id":"loader_cave","ea":"0x47B3B1","file_offset":"0x7B3B1","role":"loader_cave","expected":null,"evidence_refs":[]},
    {"id":"loader_postcopy","ea":"0x428961","file_offset":"0x28961","role":"loader_postcopy","expected":null,"evidence_refs":[]},
    {"id":"save_count","ea":"0x428810","file_offset":null,"role":"save_count","expected":null,"evidence_refs":[]},
    {"id":"writer_primary","ea":"0x45C860","file_offset":null,"role":"writer","expected":null,"evidence_refs":[]},
    {"id":"writer_secondary","ea":"0x45C8D0","file_offset":null,"role":"writer","expected":null,"evidence_refs":[]},
    {"id":"writer_final","ea":"0x45EF80","file_offset":null,"role":"writer","expected":null,"evidence_refs":[]}
  ],
  "gap_matrix": [
    {"id":"save_sizes_layouts","required":["stock_size","expanded_size","stock_layout","expanded_layout"],"status":"evidence_absent"},
    {"id":"loader_abi","required":["function_bounds","calling_convention","arguments","registers","stack","return","branches","failure_semantics","raw_bytes","complete_xrefs"],"status":"evidence_absent"},
    {"id":"writer_abi","required":["function_bounds","calling_convention","arguments","registers","stack","return","raw_bytes","complete_xrefs"],"status":"evidence_absent"},
    {"id":"record_geometry","required":["record_count","record_size","pool_base","tail","gap","serializer_bounds"],"status":"evidence_absent"},
    {"id":"padding","required":["index_256_unreachable","index_257_unreachable","index_258_unreachable","index_259_unreachable","all_non_saveable"],"status":"evidence_absent"},
    {"id":"encoding","required":["checksum","encryption","compression"],"status":"evidence_absent"},
    {"id":"save_lifecycle","required":["stock_import_conversion","rotation","temporary_file","atomic_replacement","failed_load_nonmutation","offline_catch_up_order"],"status":"evidence_absent"},
    {"id":"identity_boundaries","required":["manager_identity","pool_identity","record_149","record_150","record_254","record_255"],"status":"evidence_absent"},
    {"id":"runtime_receipts","required":["loader_fault_instruction","loader_fault_call_state","stock_import","expanded_save_reload","offline_catch_up","failed_load_nonmutation","save_rotation","late_records","padding","stored_indices","current_origins_behavior","player_validation"],"status":"evidence_absent"}
  ],
  "evidence_policy": {
    "authenticated_exporter_manifest_required": true,
    "complete_folder_inventory_required": true,
    "all_native_rows_full_folder_bound": true,
    "historical_hang_requires_exact_instruction_and_call_state": true,
    "prose_only_rejected": true,
    "synthetic_evidence_rejected": true,
    "in_memory_evidence_rejected": true
  },
  "runtime_evidence": {"candidate":null,"authenticated":false,"structural_valid":false,"gate_ready":false},
  "decision": {"publication_ready":false,"runtime_go":false,"player_go":false,"native_emission_permitted":false,"status":"STOP"},
  "integrity": {"canonical_sha256":"D56560DB76D725E7578715C1052775397360B1A6FD46001F59958A97D0BFBE53"}
}
